{
  "contract_version": "scale-receipt-v1",
  "source_commit": "8459c128c177a0939b1c4bf8ad9d94ee8335ad60",
  "status": "passed",
  "atom_count": 100000,
  "p50_body_bytes": 16384,
  "p95_body_bytes": 65536,
  "maximum_body_bytes": 262144,
  "logical_body_bytes": 1884405760,
  "atom_stream_digest": "a2c09676b25d2106c685c900a39662d312850c95d4790b8aee49a32eab6e0036",
  "logical_digest": "b2ac04069f8e5438dcfabdc8fef354f2cc86c66b5f77e052cd7f2a12c635a5a1",
  "input_set_digest": "dd5fc9342da983c9d0c3490c834faaf99afc274b864d2089fe3709ffbb294a20",
  "plan_digest": "8137477ea77280f812faad54c22eeefe99b0948e10837596978141687e2e8577",
  "receipt_digest": "69c4224c47b671ec2c7f4e6a70492da328d7362e4c0f9502a7574ee15c10e7ac",
  "retrieval_digest": "0015e2a8730d4b5b568cdd95391c3458433279ae8c235d0e76800edf25ef0af3",
  "semantic_atom_count": 1,
  "episodic_winner_count": 1,
  "normal_hit_count": 1,
  "spontaneous_hit_count": 1,
  "plan_replay_verified": true,
  "receipt_verified": true,
  "apply_idempotent": true,
  "observed_phase_millis": {
    "apply": 265134,
    "apply_replay": 5133,
    "integrity": 7044,
    "persist": 74488,
    "plan": 8588,
    "plan_replay": 10421,
    "receipt_verify": 11809,
    "retrieval": 915,
    "snapshot": 110030
  },
  "observed_wall_millis": 494575,
  "observed_max_rss_bytes": 2452963328,
  "observed_disk_bytes": 4279762944,
  "note": "Phase timing, sampled peak RSS, persisted temporary-directory bytes, and source-binding stability are observational fields excluded from logical_digest. Missing required 100,000-atom resource measurements or source binding make evidence inconclusive; observed threshold breaches make it failed. source_binding_complete=true.",
  "evidence_digest": "c142b91642628912970f360ac97072c1ba0d3fa63615f344ead2a4f9cc295789"
}
